{
  "operation": "resolve_plan",
  "kind": "response",
  "correlation_id": "cor-1",
  "layer": {
    "name": "dftlab.hubbard",
    "version": "0.1.0"
  },
  "body": {
    "plan": {
      "engine": "hubbardflow",
      "distribution": "dftlab-hubbard",
      "version": "0.1.2",
      "commit": "e508f47aff1c6243deabb12915063b6b9d899d65",
      "contract": "hubbardflow.resolved-perturbation-plan@1.0",
      "digest": {
        "algorithm": "hubbardflow.plan-digest-v1",
        "value": "a7034a324d4b09577497bd4e6a3acc82e472120e4958ec00b75cf40e69e5bbd6"
      },
      "artifact": {
        "artifact_id": "art-lr-plan",
        "sha256": "041dc84fe6db647a1ce190ee7188330eb1fc1a308a521a21610f7a7bcf7573db",
        "media_type": "application/json"
      },
      "verification": {
        "status": "VERIFIED",
        "verified_at": "2026-10-11T05:00:00Z"
      }
    },
    "plan_status": {
      "authority": "hubbardflow",
      "vocabulary": "hubbardflow.PlanStatus",
      "value": "NOT_ESTABLISHED"
    },
    "plan_reasons": [
      "SCF_EVIDENCE_MISSING"
    ],
    "dag_digest": null
  }
}
